{
  "schema_version": 1,
  "plan": "dev",
  "issued_to": "Local Dev Station",
  "expires": "2099-01-01T00:00:00Z",
  "entitlements": {
    "modules":  { "runs": true, "auth": true, "logs": true, "recipe": true, "report": true, "mes": true, "okaya_mes": true, "health": true, "config": true, "help": true, "portal": true, "variables": true },
    "variants": { "runs": ["default"], "auth": ["local_db"], "logs": ["db"], "recipe": ["filesystem"], "report": ["standard"], "mes": ["default"], "okaya_mes": ["default"], "health": ["default"], "config": ["default"], "help": ["default"], "portal": ["default"], "variables": ["default"] },
    "features": {},
    "limits":   { "max_stations": 1, "max_users": 1 }
  },
  "signature": "dev-unsigned"
}
